{
  "schema_id": "prism-concern-resolution",
  "task_id": "20260608-full-revival-amendment",
  "merge_path": "assets/evidence/prism/20260608-full-revival-amendment/merge.json",
  "reviews": [
    "assets/evidence/prism/20260608-full-revival-amendment/claude-code.review.json",
    "assets/evidence/prism/20260608-full-revival-amendment/kimi.review.json"
  ],
  "resolutions": [
    {
      "provider": "claude-code",
      "verdict": "concern",
      "decision": "accept",
      "concern_ref": "main_concern",
      "minimum_fix_ref": "minimum_fix",
      "rationale": "该担忧成立：只写完整复活修正案仍可能复发“文档替代完成”。本轮已把完整复活口径落为机器可枚举契约、运行时检查器和终局验收约束；同时加入 Loom 角色化工程工作流契约与检查，使“最小可用执行内核”不能再作为完整复活结论。",
      "implementation_evidence": [
        "assets/contracts/full-revival-amendment.json",
        "assets/contracts/loom-workflow.json",
        "assets/contracts/terminal-goals.json",
        "runtime/core/full_revival_amendment.py",
        "runtime/core/loom_workflow.py",
        "runtime/core/complete_revival_check.py",
        "runtime/core/revival_queue.py",
        "runtime/bin/redcap"
      ],
      "verification_evidence": [
        "assets/evidence/check-receipts/20260608-full-revival-amendment/full-revival-amendment-check.receipt.json",
        "assets/evidence/check-receipts/20260608-full-revival-amendment/loom-workflow-check.receipt.json",
        "assets/evidence/check-receipts/20260608-full-revival-amendment/enforcement-check.receipt.json"
      ]
    },
    {
      "provider": "kimi",
      "verdict": "block",
      "decision": "accept",
      "concern_ref": "main_concern",
      "minimum_fix_ref": "minimum_fix",
      "rationale": "该阻塞成立：若只改终局目标文件而不改运行时，仍会把叙述闭环当成真实完成。本轮已移除完整复活的终局完成授权，重开完整复活父任务事实，并新增 Loom 角色工作流检查和完整复活修正检查；终局声明必须等待完整复活验收通过。",
      "implementation_evidence": [
        "assets/contracts/terminal-goals.json",
        "assets/evidence/task-facts/task-facts.jsonl",
        "assets/contracts/loom-workflow.json",
        "runtime/core/loom_workflow.py",
        "assets/contracts/full-revival-amendment.json",
        "runtime/core/full_revival_amendment.py",
        "runtime/core/complete_revival_check.py",
        "runtime/bin/redcap"
      ],
      "verification_evidence": [
        "assets/evidence/check-receipts/20260608-full-revival-amendment/full-revival-amendment-check.receipt.json",
        "assets/evidence/check-receipts/20260608-full-revival-amendment/loom-workflow-check.receipt.json",
        "assets/evidence/check-receipts/20260608-full-revival-amendment/enforcement-check.receipt.json"
      ]
    }
  ],
  "conclusion": {
    "state": "resolved",
    "reason": "两个评审意见均被采纳，并已绑定到真实运行时、契约文件和本轮重新执行的检查凭据；完整复活终局仍保持打开状态，禁止用最小内核替代终局完成。"
  }
}
